{
  "version": 1,
  "defaultMode": "prompt",
  "capabilities": {
    "runtime.inspect": "allow",
    "runtime.validate": "allow",
    "runtime.reconfigure": "prompt",
    "repo.validate": "allow",
    "service.validate": "allow",
    "governance.validate": "allow",
    "repo.mutate": "prompt",
    "network.authenticated.read": "prompt",
    "network.authenticated.write": "prompt",
    "system.install": "deny",
    "system.elevate": "deny"
  },
  "safeCommandExact": [
    "node scripts/validate-repo-operating-system.mjs && node scripts/validate-ona-skills.mjs && node scripts/automind-skill-pack.mjs validate && node scripts/automind-routines.mjs validate && node scripts/validate-workflows.mjs && node scripts/validate-runtime-contracts.mjs && node scripts/validate-github-automation.mjs && node scripts/github-autonomy-selftest.mjs && node scripts/validate-downstream-sync.mjs && node scripts/validate-capability-intake.mjs && node scripts/validate-runtime-topology-profiles.mjs && node scripts/validate-operator-surfaces.mjs && node scripts/validate-agentmail-runtime.mjs && node scripts/validate-browser-validation.mjs && node scripts/validate-enterprise-skill-bundles.mjs && node scripts/openclaw-fixture-smoke.mjs",
    "bash ./scripts/worker-status.sh",
    "bash ./scripts/runtime-doctor.sh",
    "node scripts/validate-repo-operating-system.mjs && node scripts/validate-ona-skills.mjs && node scripts/automind-skill-pack.mjs validate && node scripts/automind-routines.mjs validate && node scripts/validate-workflows.mjs && node scripts/validate-runtime-contracts.mjs && node scripts/validate-github-automation.mjs && node scripts/github-autonomy-selftest.mjs && node scripts/validate-downstream-sync.mjs && node scripts/validate-capability-intake.mjs && node scripts/validate-runtime-topology-profiles.mjs && node scripts/validate-operator-surfaces.mjs && node scripts/validate-agentmail-runtime.mjs && node scripts/validate-browser-validation.mjs && node scripts/validate-enterprise-skill-bundles.mjs",
    "node scripts/validate-workflows.mjs",
    "npm test --prefix services/diagnostic",
    "node scripts/validate-downstream-sync.mjs",
    "node scripts/validate-capability-intake.mjs",
    "node scripts/validate-runtime-topology-profiles.mjs",
    "node scripts/validate-agentmail-runtime.mjs",
    "node scripts/agentmail-doctor.mjs",
    "node scripts/agentmail-live-check.mjs",
    "node scripts/validate-browser-validation.mjs",
    "node scripts/plan-browser-validation.mjs --mode branch",
    "node scripts/validate-enterprise-skill-bundles.mjs",
    "node scripts/openclaw-fixture-smoke.mjs",
    "bash ./scripts/bootstrap-recovery.sh --dry-run",
    "bash ./scripts/configure-openclaw-agents.sh"
  ],
  "blockedCommandTokens": [
    "remove-item",
    "del ",
    "erase ",
    "rmdir ",
    "rd ",
    "rm -rf",
    "format-",
    "shutdown",
    "restart-computer",
    "stop-computer",
    "set-executionpolicy",
    "invoke-expression",
    "iex ",
    "start-process",
    "schtasks",
    "sc.exe",
    "git reset --hard",
    "git checkout --",
    "git clean",
    "reg add",
    "reg delete",
    "curl ",
    "invoke-webrequest",
    "invoke-restmethod"
  ]
}
